gemma_files	gemma files is a canadian horror writer journalist and film critic her short
gemma_o'connor_:writer	gemma oconnor is an irish mystery writer born in dublin in 1940 in 1995 she
gen_urobuchi	gen urobuchi is a japanese writer for visual novels light novels and anime he
gene_deweese	thomas eugene deweese was an american writer of science fiction best known for
gene_hong	gene hong is an american writer actor and producer best known for his writing
gene_levitt	eugene levitt was an american television writer producer and director
gene_luen_yang	gene luen yang  is an asian-american cartoonist he is a frequent lecturer on
gene_wojciechowski	gene wojciechowski is a sports writer best known for his work with espn born
genevieve_billette	genevieve billette is a quebec writer and translator she was born in quebec
genevieve_brisac	genevieve brisac is a french writer and winner of the prix femina 1996 for week-end
genevieve_clay	genevieve clay-smith is an australian-born writer and film director she grew
genevieve_foster	genevieve stump foster was an american childrens writer who illustrated most
gennifer_choldenko	gennifer choldenko is an american writer of popular books for children and adolescents
gennifer_hutchison	gennifer hutchison is an american television writer she is best known for her
geoff_dyer	geoff dyer is an english writer he is the author of four novels and seven books
geoff_ryman	geoffrey charles ryman is a writer of science fiction fantasy and surrealistic
geoff_thompson_:writer	geoff thompson is a writer teacher and self-defence instructor he has written
geoff_wolinetz	geoff wolinetz is a writer and co-founder of yankee pot roast an online magazine
geoffrey_archer_:writer	geoffrey archer is a fiction writer from london he specialises in military
geoffrey_atherden	geoffrey john atherden am is an australian television writer especially of comedy he
geoffrey_dennis	geoffrey dennis is an english writer who won the hawthornden prize in 1930 for
geoffrey_hoyle	geoffrey hoyle is an english science fiction writer best known for the works
geoffrey_kingscott	geoffrey kingscott was a british writer journalist editor translator and ukip
geoffrey_maloney	geoffrey maloney is an australian writer of speculative short fiction
geoffrey_ursell	geoffrey ursell is a canadian writer who won the books in canada first novel
georg_heym	georg heym was a german writer he is particularly known for his poetry representative
george_ade	george ade was an american writer newspaper columnist and playwright
george_anania	george anania was a romanian science-fiction writer and translator
george_burditt_:writer	george henry burditt was an american television writer and producer he wrote
george_calderon	george leslie calderon was an english writer he was one of the most knowledgeable
george_caragonne	george caragonne was an american comic book writer and editor most notable for
george_chigas	george chigas is an american writer and scholar he is currently a professor
george_clayton_johnson	george clayton johnson was an american science fiction writer best known for
george_cockings	george cockings was an english writer
george_dicaprio	george paul dicaprio is an american writer editor publisher and distributor
george_dohrmann	george anderson dohrmann is a contributing writer for sports illustrated the
george_dubourg	george dubourg was a writer on the violin dubourg grandson of matthew dubourg
george_eckstein	george eckstein was an american writer and television producer whose career
george_egerton	mary chavelita dunne bright better known by her pen name george egerton was
george_elliott_:canadian_writer	george matthew elliott was a canadian short story writer
george_f.willison	george findley willison was a writer and editor who specialized in american
george_forrest_:author	george forrest was a writer of music and lyrics for musical theatre best known
george_geary_bennis	george geary bennis was a writer originally from limerick in ireland at different
george_gipe	george gipe was an american magazine writer author and screenwriter gipe died
george_gladir	george gladir was an american writer for comic books primarily known as a scripter
george_griffith	george griffith full name george chetwynd griffith-jones was a prolific british
george_grigore	george grigore is a romanian writer essayist translator professor researcher
george_harmon_coxe	george harmon coxe was an american writer of crime fiction he is perhaps best
george_henry_moore_:author	george henry moore was an american historical writer and librarian
george_hively	george hively was a film writer and film editor from 1917 to 1945 hively was
george_jonas	george jonas cm was a hungarian-born canadian writer poet and journalist a
george_joseph_gustave_masson	george joseph gustave masson was an english-born educational writer with a french
george_k.mannickarottu	george k mannickarottu popularly known as george mannickarottu or just mannickarottu
george_kashdan	george kashdan was an american comic book writer and editor primarily for dc
george_khoury_:author	george khoury is a writer and interviewer in the field of comic books khourys
george_langelaan	george langelaan was a british writer and journalist born in paris france he
george_leonard	george burr leonard was an american writer editor and educator who wrote extensively
george_lockhart_:politician	sir george lockhart of lee of carnwath south lanarkshire also known as lockhart
george_m.merrick	george martin merrick born february 2 1883 in buffalo new york usa died december
george_macovescu	george macovescu was a romanian writer and communist politician who served as
george_madden_martin	george madden martin was an early 20th century american fiction writer
george_malcher	george charles malcher also known as gc malcher or jerzy karol malcher was
george_mcleod_winsor	george mcleod winsor was a british writer his novels of science fiction more
george_mcwhirter	george mcwhirter is a northern irish-canadian writer translator editor teacher
george_meniuc	george meniuc was a writer from moldova
george_metcalf_johnson	george metcalf johnson was an american writer of mystery and western stories many
george_mogridge_:old_humphrey	george mogridge was a prolific 19th century writer poet and author of childrens
george_monbiot	george joshua richard monbiot is a british writer known for his environmental
george_moreby_acklom	george moreby acklom was a british writer editor literary adviser and critic
george_nafziger	george f nafziger is an american writer and editor of numerous books and articles
george_perez	george perez is an american writer and illustrator of comic books whose titles
george_reinblatt	george reinblatt is a comedy writer from toronto canada best known for writing
george_saunders	george saunders is an american writer of short stories essays novellas and childrens
george_tabori	george tabori was a hungarian writer and theater director
george_thengummoottil	george thengummoottil is an indian writer and photographer known for his travel
george_tofan	george tofan was a writer and official from austro hungary moldavian democratic
george_turner_:writer	george reginald turner was an australian writer and critic best known for the
george_urban	george robert urban was a hungarian writer best known as a broadcaster for radio
george_w.dick	george w dick also known as g-wiz is an american writer actor director and
george_washington_moon	george washington moon was an english writer of the late nineteenth and early
george_wheeler_hinman	george wheeler hinman was an american writer and newspaper publisher he also
george_wilbur_peck	george wilbur peck was an american writer and politician from wisconsin he
george_william_curtis	george william curtis was an american writer and public speaker born in providence
george_william_johnson_:writer	george william johnson was a british writer on gardening
george_william_russell	george william russell who wrote with the pseudonym  was an irish writer editor
george_woodcock	george woodcock was a canadian writer of political biography and history an
george_wyatt_:writer	george wyatt was a sixteenth-century writer he was the first biographer of
georgelle_hirliman	georgelle cynthia hirliman was an american writer and adopted daughter of eleanor
georges_baal	georges baal was a hungarian writer theatrologist actor director and psychologist georges
georges_belmont	georges belmont born georges pelorson was a french writer and literary translator his
georges_cogniot	georges cogniot was a french writer philosopher and politician
georges_de_bievre	georges de bievre francois georges mareschal bievre marquis was a french writer
georges_dessommes	georges dessommes was an american french language writer he was edouard dessommes
georges_ista	georges ista was a belgian writer known for his work in the walloon language a
georges_limbour	georges limbour was a french writer of prose and poetry he was a member of
georges_perros	georges perros was a french writer he was awarded the prix litteraire valery
georges_pillement	georges pillement was a french writer translator and photographer he was born
georges_polti	georges polti or george polti was a french writer best-known today for his list
georges_ribemont-dessaignes	georges ribemont-dessaignes was a french writer and artist associated with the
georges_simenon	georges joseph christian simenon was a belgian writer a prolific author who
georges_smal	georges smal was a belgian writer who wrote mainly in the walloon language he
georgi_karaslavov	georgi karaslavov was a bulgarian writer born in the debar district of the town
georgi_pulevski	georgi pulevski or gjorgji pulevski was a writer and revolutionary from galicnik
georgi_vladimov	georgi nikolayevich vladimov was a russian dissident writer
georgia_byng	georgia byng is a british childrens writer illustrator actress and film producer
gerald_brenan	for the australian rules footballer see gerald brennan edward fitzgerald gerald
gerald_carr_:cartoonist	gerald carr is an australian comic book writer artist and illustrator best known
gerald_clarke_:author	gerald clarke is an american writer best known for the biographies capote and
gerald_ganglbauer	gerald ganglbauer is an austrian-australian writer and publisher diagnosed with
gerald_j.tate	gerald j tate is a northern irish horror writer who is also a time served aircraft
gerald_mcmorrow	gerald mcmorrow is an english writer and filmmaker
gerald_o'carroll	gerald ocarroll is an irish writer and historian born in tralee county kerry
gerald_reece	sir gerald reece kcmg cbe dl was a british writer and colonial administrator he
gerald_tomlinson	gerald arthur tomlinson was a crime writer and editor he wrote about sports
gerald_vizenor	gerald robert vizenor is an anishinaabe writer and scholar and an enrolled member
gerald_w.page	gerald w page is an american writer of fantasy science fiction mystery and
gerard_de_villiers	gerard de villiers was a french writer journalist and publisher whose sas series
gerard_klein	gerard klein known also as gilles dargyre is a french science fiction writer
gerard_mckeown	gerard mckeown is a writer from ballymena northern ireland a graduate of cumbria
gerard_reve	gerard kornelis van het reve was a dutch writer he started writing as simon
gerard_stembridge	gerard gerry stembridge is an irish writer director and actor he was educated
gerasimos_vokos	gerasimos vokos was a greek writer he was a journalist from the hydriot family
gerbrand_bakker_:novelist	gerbrand bakker is a dutch writer he won the international impac dublin literary
gerda_weissmann_klein	gerda weissmann klein  is a polish-born american writer and human rights activist her
gerhard_dengler	gerhard dengler was an east german writer print and broadcast journalist and
gerhard_polt	gerhard polt is a bavarian writer filmmaker actor and satirical cabaret artist gerhard
gerit_quealy	gerit quealy is an american writer editor and actor she is the co-author of
gerlind_reinshagen	gerlind reinshagen is a german writer the daughter of ekkehard and friedel
germain-francois_poullain_de_saint-foix	germain-francois poullain de saint-foix was an 18th-century french writer and
germaine_greer	germaine greer is an australian-born writer regarded as one of the major voices
germaine_guevremont	germaine guevremont born grignon was a canadian writer who was a prominent figure
german_sadulaev	german umaralievich sadulaev is a chechen writer
gerry_conway	gerard f gerry conway is an american writer of comic books and television shows he
gerry_davis_:screenwriter	gerry davis was a british television writer best known for his contributions
gerry_finley-day	gerry finley-day is a scottish comics writer prolific from the 1960s to the
gerry_hassan	gerry hassan is a scottish writer academic and research fellow in cultural policy
gerry_hunt	gerry hunt is an irish comics writer and artist he worked as an architect for
gert_hofmann	gert hofmann was a german writer and professor of german literature hofmann
gert_prokop	gert prokop was a german writer of science fiction and crime fiction he spent
gertrude_barrows_bennett	gertrude barrows bennett was the first major female writer of fantasy and science
gertrude_bell	gertrude margaret lowthian bell cbe was an english writer traveller political
geum_hee	geum hee is a south korean writer
geza_beremenyi	geza beremenyi is a hungarian writer screenwriter and film director he was
geza_csath	geza csath was a hungarian writer playwright musician music critic psychiatrist
geza_gardonyi	geza gardonyi born geza ziegler was a hungarian writer and journalist although
ghada_al-samman	ghada al-samman is a syrian writer journalist and novelist born in damascus
ghalib_shiraz_dhalla	ghalib shiraz dhalla punjabi     born in mombasa kenya is a los angeles-based
ghassan_kanafani	ghassan kanafani was a palestinian writer and a leading member of the popular
ghazaros_aghayan	ghazaros stepani aghayan was an armenian writer educator folklorist historian
gheorghe_asachi	gheorghe asachi was a moldavian later romanian prose writer poet painter historian
gheorghe_voda	gheorghe voda was a writer from moldova among the participants of the funeral
gholam-hossein_sa'edi	gholam-hossein saedi md was a prolific iranian writer he has published over
ghulam_sarwar	ghulam sarwar is a bangladeshi-born british writer on islam in english and director
giammaria_mazzucchelli	count giammaria mazzuchelli was an italian writer bibliographer and historian
gian_paolo_borghetti	gian paolo borghetti was a corsican writer poet and politician he has been
giancarlo_magalli	giancarlo magalli is an italian television writer and presenter
gianfranco_clerici	gianfranco clerici is an italian writer of numerous screenplays for italian
giani_dhanwant_singh_sital	giani dhanwant singh sital was a punjabi writer who contributed enormously to
gianluca_arrighi	gianluca arrighi is an italian writer born in rome arrighi graduated in criminal
gianna_manzini	gianna manzini was an italian writer whose ritratto in piedi won her the premio
giannina_braschi	giannina braschi is a puerto rican writer she is credited with writing the
giannis_agouris	giannis agouris was a greek writer and journalist from achaia
giddens_ko	giddens ko is a taiwanese writer and director born on 25 august 1978 in changhua
gideon_defoe	gideon defoe is a british writer and author of the pirates! a series of comedy
gideon_joubert	gideon joubert was a south african writer and journalist who was known for his
gidugu_venkata_ramamoorty	gidugu venkata ramamurthy was a telugu writer and one of the earliest modern
gil_filar	gilbert gil paul filar is a canadian writer ex-actor and -magician he is known
gilbert_collard	gilbert collard is a french writer barrister and politician he is a prominent
gilbert_gerard_:theological_writer	gilbert gerard was a scottish theological writer the son of alexander gerard
gilbert_king_:author	gilbert anthony king is an american writer and photographer he is known best
gilbert_lawford_dalton	gilbert lawford dalton was a prolific writer of stories for british boys comics he
giles_milton	giles milton is a writer who specialises in narrative history his books have
gilles_leroy	gilles leroy is a french writer he studied at the lycee lakanal in sceaux which
gilles-francois_de_beauvais	gilles-francois de beauvais was a french jesuit writer and preacher born at
gillian_bouras	gillian bouras is an expatriate australian writer who has written several books
gillian_duffy_:editor	gillian duffy is an english food writer and editor of new york magazine and
gillian_horvath	gillian horvath is a television writer and producer in the united states and
gillian_mears	gillian mears was an australian short story writer and novelisther books ride
gillian_polack	gillian polack is an australian writer and editor working mainly in the field
gillian_riley	gillian riley is an english food writer she was born and brought up in yorkshire
ginette_anfousse	ginette anfousse is a quebec writer and illustrator of childrens books she
ginette_mathiot	ginette mathiot officier de la legion dhonneur was a french food writer and
ginger_wadsworth	virginia ginger wadsworth is an american writer of biographies western american
ginia_bellafante	ginia bellafante is an american writer and critic for the new york times she
ginn_hale	ginn hale is an american writer of speculative fiction
giorgio_a.tsoukalos	giorgio a tsoukalos is a swiss-born greek-american writer and television personality he
giorgio_amendola	giorgio amendola was an italian writer and politician born in rome in 1907
giorgio_faletti	giorgio faletti was an italian writer actor comedian and singer-songwriter born
giorgio_nadali	giorgio nadali is an italian writer and journalist
giorgio_nurigiani	giorgio nurigiani was an italian writer publicist linguist and historian from
giorgio_pressburger	giorgio pressburger is an italian writer of novels and short stories born in
giorgio_van_straten	giorgio van straten is an italian writer and manager of arts organizations his
giovan_battista_di_crollalanza	giovan battista di crollalanza was an italian writer from 1841 he published
giovanni_antonio_palazzo	giovanni antonio palazzo was an italian writer on government and reason of state michel
giovanni_arduino_:author	giovanni arduino is a fiction writer freelance editor translator and consultant
giovanni_battista_cavalcaselle	giovanni battista cavalcaselle was an italian writer and art critic best known
giovanni_boccaccio	giovanni boccaccio was an italian writer poet correspondent of petrarch and
giovanni_testori	giovanni testori was an italian writer playwright art historian and literary
giovanni_verga	giovanni carmelo verga was an italian realist writer best known for his depictions
girija_keer	girija keer is a marathi writer from maharashtra india she started her career
girija_kumar_mathur	girijakumar mathur was a notable indian writer of the hindi language he is
girolamo_de_rada	geronimo de rada was an albanian writer of italo-albanian literature of arbereshe
gisbert_haefs	gisbert haefs is a german writer in several genres and translator he has written
gisele_bienne	gisele bienne is a french writer who has written many novels she lives in reims
gisele_lagace	gisele lagace is a writer and illustrator of webcomics she was born june 16
gisele_prassinos	gisele prassinos is a french writer of greek heritage associated with the surrealist
gish_jen	gish jen born lillian jen august 12 1955 is a contemporary american writer
gita_mehta	gita mehta is an indian writer and was born in delhi in a well-known odia family she
gita_sahgal	gita sahgal kashmiri   born 19561957 in bombay india is a writer and journalist
giulia_enders	giulia enders is a german writer and scientist whose first book gut the inside
giuliana_morandini	giuliana morandini is an italian writer she was born in udine and lives in
giulio_angioni	giulio angioni is an italian writer and anthropologist
giulio_cesare_croce	giulio cesare croce was an italian writer actorproducer of cantastoria and
giulio_cogni	giulio cogni was an italian writer racial theorist music composer and music
giuseppe_berto	giuseppe berto was an italian writer and screenwriter he is mostly known for
giuseppe_tomasi_di_lampedusa	giuseppe tomasi di lampedusa was an italian writer and the last prince of lampedusa he
gladys_casely-hayford	gladys may casely-hayford alias aquah laluah was a gold coast-born sierra leonean
gladys_lucy_adshead	gladys lucy adshead was a british-born writer of childrens books adshead was
gladys_taylor_:publisher	gladys taylor nee tall was a canadian writer and publisher born in swan river
glaydah_namukasa	glaydah namukasa is a ugandan writer and midwife she is the author of two novels
gleb_uspensky	gleb ivanovich uspensky was a russian writer and a prominent figure of the narodnik
glen_whitman	glen whitman is an american television writer and scientist
glenda_millard	glenda millard is an australian writer of childrens literature and young-adult
glendon_swarthout	glendon fred swarthout was an american writer and novelist one of his best
glenn_eichler	glenn eichler is an american comedy writer who started out as an editor for
glenn_ficarra	glenn ficarra is an american writer producer actor and director
glenn_gordon_caron	glenn gordon caron is an american television writer director and producer probably
glenn_kurtz	glenn kurtz is a writer and the author of practicing a musicians return to
glenn_o'brien	glenn obrien is an american writer largely on the subjects of art music and
glenn_rockowitz	glenn rockowitz is an american writer filmmaker comedian and voice actor he
gloria_escomel	gloria escomel is a canadian writer she first moved from uruguay to france
gloria_lise	gloria lise is an argentine writer lawyer professor and an accomplished musician she
gloria_perez	gloria maria rebelo ferrante perez is a brazilian television telenovela writer
glyn_moody	glyn moody is a technology writer he is best known for his book rebel code linux
glyn_parry_:author	glyn parry is an australian writer of childrens literature young-adult fiction
gnani_sankaran	gnani is a popular writer in the tamil language he has also written articles
go_osaka	go osaka is a japanese writer of crime fiction hardboiled thriller spy fiction
goffredo_alessandrini	goffredo alessandrini was an italian script writer and film director he also
goffredo_parise	goffredo parise was an italian writer and journalist he won the viareggio prize
gogu_shyamala	gogu shyamala is a telugu language writer and womens activist she is also a
gokulchandra_nag	gokulchandra nag was a bengali writer and artist best known as one of the founding
golam_mostofa_:poet	golam mostofa was a pakistani bengali writer and poet
gong_sun-ok	gong sun-ok is a modern korean writer
gonzalo_argote_de_molina	gonzalo argote de molina was a spanish writer historian and genealogist
gonzalo_suarez	gonzalo suarez morilla is a spanish writer screenwriter and film director
gopal_mayekar	gopal mayekar was a writer and a leader of maharashtrawadi gomantak party he
gopala_chandra_praharaj	gopala chandra praharaj was a writer and linguist in the odia language well
goran_vojnovic	goran vojnovic is a slovenian writer poet screenwriter and film director of
gordon_hyatt	gordon hyatt is an award-winning american writer and television producer hyatt
gordon_lish	gordon jay lish is an american writer as a literary editor he championed many
gordon_r.dickson	gordon rupert dickson was a canadian-american science fiction writer he was
gordon_rennie	gordon rennie is a scottish comics writer responsible for white trash moronic
gordon_russell_:writer	gordon russell was an american daytime soap opera writer russell was also an
gordon_snell	gordon snell is a childrens writer and scriptwriter his books include amys
gordon_stewart_anderson	gordon stewart anderson was a canadian writer whose novel the toronto you are
gordon_waterman_chaplin	gordon chaplin is an american writer and conservationist
gore_vidal	gore vidal was an american writer and a public intellectual known for his patrician
goro_masaki	goro masaki is a japanese science fiction writer whose career began in 1986 his
gorur_ramaswamy_iyengar	goruru ramaswamy iyengar popularly known as goruru was a kannada writer well
gotlib	gotlib is a french comics artistwriter and publisher through his own work
gotthold_ephraim_lessing	gotthold ephraim lessing was a german writer philosopher dramatist publicist
gotthold_gloger	gotthold gloger was a german writer and painter
gour_das_bysack	gour das bysack was a bengali writer prominent in the late 19th century he
gourahari_das	dr gourahari das is a story writer novelist columnist of odisha india
graca_aranha	jose pereira da graca aranha was a brazilian writer and diplomat considered
grace_duffie_boylan	grace duffie boylan was an american writer she wrote many childrens books often
grace_ellery_channing	grace ellery channing was a writer and poet who published often in the land
grace_hallock	grace taber hallock was an american childrens writer of the early to mid-20th
grace_james	grace edith marion james was an english writer of childrens literature and a
grace_jones_morgan	grace jones morgan was a canadian-born pulp fiction writer and novelist she
grace_kennedy_:writer	grace kennedy was a scottish writer she was the fourth daughter of robert kennedy
grace_lin	grace lin is an american childrens writer and illustrator lins parents were
grace_lumpkin	grace lumpkin was an american writer of proletarian literature focusing most
grace_mann_brown	grace mann brown was an american writer and spiritual leader her work was related
grace_paley	grace paley was an american short story writer poet teacher and political activist
grace_randolph	grace randolph is a comic book writer and the host and creator of youtube channels
graciliano_ramos	graciliano ramos de oliveira was a brazilian modernist writer politician and
