nathalie_gassel	nathalie gassel is a belgian writer and photographer born in brussels she is
nathan_birnbaum	nathan birnbaum was an austrian writer and journalist jewish thinker and nationalist his
nathan_burgoine	nathan burgoine is a canadian writer his debut novel light was a shortlisted
nathan_burrage	nathan burrage is an australian writer of speculative fiction born 7 january
nathan_edmondson	nathan edmondson is an american writer known for the comic series who is jake
nathan_fielder	nathan fielder is a canadian writer and comedian he is best known for creating
nathan_filer	nathan filer is a british writer best known for his debut novel the shock of
nathan_penlington	nathan penlington is a writer poet live literature producer and magician his
nathan_shaham	nathan shaham is an israeli writer
nathan_thrall	nathan thrall is an american writer journalist and analyst on the middle east he
nathanael	nathanael is a canadian writer literary translator and educator some of her
nathaniel_peabody_rogers	nathaniel peabody rogers was an american abolitionist writer who from june 1838
nathuram_premi	nathuram premi was a writer publisher poet editor linguist and an intellectual
natsuhiko_kyogoku	natsuhiko kyogoku is a japanese mystery writer who is a member of osawa office he
navid_kermani	navid kermani is a german writer and a scholar of islam he is the author of
navid_moazzez	navid moazzez is a swedish writer speaker podcaster and consultant who is regarded
nawal_el_saadawi	nawal el saadawi is an egyptian feminist writer activist physician and psychiatrist she
nawal_kishore_dhawal	nawal kishore dhawal was an indian writer poet proof reader editor critic journalist
nay_myo_thant	nay myo thant is a burmese writer his books include two volumes of short stories
nay_win_myint	nay win myint is a burmese writer born in pwintbyu township magwe division burma he
nayantara_sahgal	nayantara sahgal is an indian writer in english her fiction deals with indias
nazir_ahmad_dehlvi	nazir ahmad dehlvi also known as diptee nazir ahmad was an urdu writer social
ndyakira_amooti	ndyakira ntamuhiira amooti was a ugandan childrens writer journalist and environmentalist
neal_asher	neal asher is an english science fiction writer he lives near chelmsford
neal_brennan	neal brennan is an american writer stand-up comedian actor director and producer he
neal_drinnan	neal drinnan is an australian writer he won the lambda literary award in the
neal_kozodoy	neal kozodoy is an american writer journalist and editor kozodoy joined the
neal_shusterman	neal shusterman is an american writer of young-adult fiction he won the national
neal_stephenson	neal town stephenson is an american writer and game designer known for his works
neal_thompson	neal thompson is an american non-fiction writer who resides in asheville north
necati_cumal	necati cumal was a turkish writer of novels short-stories essays and poetry he
ned_vizzini	ned vizzini was an american writer he was the author of four books for young
nedzad_ibrisimovic	nedzad ibrisimovic was a bosnian writer and sculptor between 1993 and 2001
neel_mukherjee_:writer	neel mukherjee is an indian writer writing in english his book past continuous
neela_padmanabhan	neela padmanabhan is a tamil writer from nagercoil india he also writes in
nega_mezlekia	nega mezlekia is an ethiopian writer who writes in english his first language
neil_druckmann	neil druckmann is an israeli-american writer creative director and programmer
neil_innes	neil james innes is an english writer comedian and musician best known for his
neil_macfarquhar	neil graham macfarquhar is an american writer who is currently writing for the
neil_mossey	neil mossey is a british comedy writer and television producer his credits
neil_smith_:writer	neil smith is a fiction writer who lives in montreal his most recent book a
neil_tolkin	neil tolkin is a canadian screen writer from montreal he attended westmount
nejc_gazvoda	nejc gazvoda is a slovene writer screenwriter and director he has published
nele_neuhaus	cornelia neuhaus is a german writershe is best known for her crime thrillers
neli_kodric	neli kodric filipic is a slovene childrens writer her first book lov na zvezde
nell_dixon	nell dixon is a british writer of romance novels since 2006 she the only author
nella_bielski	nella bielski is a ukrainian-born french writer and actress bielski was born
nellie_campobello	nellie francisca ernestina campobello luna was a mexican writer she is notable
nellie_hermann	nellie hermann is an american writer who lives in new york and the author of
nellikkal_muraleedharan	dr nellickal muraleedharan was a noted writer and poet in malayalam he received
nelson_algren	nelson algren was an american writer he may be best known for the man with
nelson_ikon_wu	nelson ikon wu was a chinese and american writer and professor of asian art
nene_gare	nene gare was an australian writer and artist best known as the author of the
netta_muskett	netta muskett was a british writer of more than 60 romance novels from 1927
netta_syrett	netta syrett was an english writer of the late victorian period whose novels
nev_fountain	nev fountain born steven john fountain is an english writer best known for his
nevenka_petric	nevenka petric is a serbian writer poet educationalist and expert in the fields
neville_cardus	sir john frederick neville cardus cbe was an english writer and critic from
nevin_halc	nevin halc is a turkish writer and lecturer of turkish cuisine she has published
ng_yi-sheng	cold water ng yi-sheng is a singaporean gay writer he has published a collection
ngaio_marsh	dame ngaio marsh dbe born edith ngaio marsh was a new zealand crime writer and
ngan_xuyen	pham xuan nguyen better known by his pen name ngan xuyen is a vietnamese writer
ngugi_wa_thiong'o	ngugi wa thiongo is a kenyan writer formerly working in english and now working
nguyen_an_ninh	nguyen an ninh was a vietnamese writer activist and revolutionary during the
nguyen_ngoc_ngan	nguyen ngoc ngan is a vietnamese-canadian writer and essayist he was born in
nguyen_ngoc_tu	nguyen ngoc tu is a vietnamese short story writer and novelist from ca mau province
nguyen_quang_lap	nguyen quang lap is a vietnamese writer playwright and screenwriter he has
nguyen_quang_tuan	nguyen quang tuan is a writer poet and researcher in south vietnam he was born
ni_ko_ye	ni ko ye born ye win was a prominent burmese writer writing 30 novels throughout
nic_kelman	nic kelman is a writer of novels short stories non-fiction screenplays and essays
niccolo_tucci	niccolo tucci was a short story writer and novelist who wrote in english and
nicholas_delbanco	nicholas delbanco is an american writer
nicholas_kollerstrom	nicholas kollerstrom is an english writer formerly an honorary research fellow
nicholas_luard	nicholas lamert luard was a writer and politician but is perhaps best known
nicholas_rankin	nicholas rankin is a british writer and broadcaster rankin was born in yorkshire
nicholas_sparks	nicholas charles sparks is an american novelist screenwriter and producer he
nicholas_tchkotoua	his illustrious highness prince nicholas tchkotoua was a georgian writer and
nicholas_whittaker	nicholas whittaker is a british writer of non-fiction books on popular culture
nicholas_wootton	nicholas wootton is an american emmy award-winning television writer and producer he
nick_arnold	nick arnold is a british writer of science books for children he is best known
nick_bakay	nicholas nick bakay is an american writer actor voice actor comedian and sportscaster he
nick_bernardone	nicholas francis bernardone is an american writer comedian director  his tv
nick_bertozzi	nick bertozzi is an american comic book writer and artist as well as a commercial
nick_crittenden_:writer	nick crittenden frsa is a british writer and researcher who has worked in uk
nick_davis_:television_and_movie_producer	nick davis is a writer director and producer he is the son of film director
nick_dear	nick dear is an english writer for stage screen and radio he received a bafta
nick_flynn	nick flynn is an american writer playwright and poet his most recent publication
nick_hurst	nick hurst is an english writer who in 2012 published his first book sugong the
nick_joaquin	nicomedes marquez joaquin was a filipino writer historian and journalist best
nick_mcdonell	robert nicholas nick mcdonell is an american writer who has worked as a journalist
nick_spencer	nick spencer is a comic book writer and former politician as a comic book writer
nick_stone_:author	nick stone is a british thriller writer
nick_toczek	nick toczek is a british writer and performer working variously as poet journalist
nick_towne	nick towne is an american television writer he has been nominated for a writers
nick_twinamatsiko	nick twinamatsiko is a ugandan writer and civil engineer he is the author of
nick_walters	nick walters is a british writer he has written many spin off novels based
nicky_moey	nicky moey is a singaporean writer best known for his collections of fiction
nicola_cornick	nicola cornick is a british writer of historical romance novels since 1998 and
nicola_lagioia	nicola lagioia is an italian writer born in bari lagioia debuted as a novelist
nicola_palazzo	nicola palazzo castelluccio superiore is an italian writer
nicolae_negru	nicolae negru is a writer and journalist from moldova he works for jurnal tv
nicolai_costenco	nicolai costenco was a writer from moldova he was managing editor of viata
nicolas_billon	nicolas billon is a canadian writer he is best known for his plays the elephant
nicolas_chamfort	sebastien-roch nicolas also known as chamfort was a french writer best known
nicolas_deschamps_:writer	nicolas deschamps was a french jesuit controversial writer
nicolas_falacci	nicolas falacci is a television writer and producer along with his wife and
nicolas_gomez_davila	nicolas gomez davila was a colombian writer and thinker who is considered one
nicole_dubuc	nicole dubuc is an american writer perhaps best known for her multiple emmy-nominated
nicole_houde	nicole houde is a quebec writer the daughter of therese simard and roland houde
nidudavolu_venkatarao	nidudavolu venkatarao is a famous telugu writer and research scholar
niel_bushnell	niel bushnell is an english writer and artist from hartlepool he is the author
nigar_rafibeyli	nigar khudadat qizi rafibeyli was azerbaijani writer and the chairman of the
nigel_bennett	nigel bennett is an anglo-canadian actordirectorwriter who has been based
nigel_calder	nigel david mckail ritchie-calder was a british science writer
nigel_collins	nigel collins is a boxing writer for espn and former editor-in-chief of ring
nigel_nicolson	nigel nicolson obe was an english writer publisher and politician
nigel_rodgers	nigel rodgers is a british writer environmentalist and critic rodgers has written
nigel_slater	nigel slater is an english food writer journalist and broadcaster he has written
nigoghos_sarafian	nigoghos sarafian was an armenian writer poet editor and journalist
nihal_atsz	huseyin nihal atsz was a prominent turkish nationalist writer novelist poet
nik_welter	nikolaus nik welter was a luxembourgish writer playwright poet professor literary
nikephoros_i_of_constantinople	st nikephoros i or nicephorus i was a christian byzantine writer and ecumenical
nikhil_goyal	nikhil goyal is an american journalist and author of schools on trial how freedom
nikhilanand_panigrahy	dr nikhilanand panigrahy is a popular science writer of promise columnist from
nikifor_mran'ka	nikifor mranka - is a chuvash writer and playwright he was born on july 9 1901
nikil_saval	nikil saval is an american writer editor and journalist
nikita_larionov	nikita larionovic larionov was a writer and poet larionov was a member of the
niko_nikoladze	niko nikoladze was a notable georgian writer pro-western enlightener and public
niko_pucic	niko pucic de zagorien was a serbian writer and politician from dalmatia he
nikola_milosevic_:politician	nikola milosevic phd was a serbian writer political philosopher literary critic
nikolai_garin-mikhailovsky	nikolai georgievich mikhailovsky was a russian writer and essayist locating
nikolai_karonin-petropavlovsky	nikolai elpidiforovich karonin-petropavlovsky was a russian writer essayist
nikolai_leykin	nikolai alexandrovich leykin was a russian writer artist playwright journalist
nikolai_naumov	nikolai ivanovich naumov was a russian writer
nikolai_ostrovsky	nikolai alexeevich ostrovsky was a soviet socialist realist writer of ukrainian
nikolai_spathari	nikolai spathari was a moldavian writer diplomat and traveler milescu spoke
nikolai_starikov	nikolai viktorovich starikov is a russian writer opinion journalist social activist
nikolai_teleshov	nikolai dmitryevich teleshov was a russiansoviet writer
nikolai_tikhonov_:writer	nikolai semenovich tikhonov was a soviet writer and member of the serapion brothers
nikolai_uspensky	nikolai vasilyevich uspensky was a russian writer and a cousin of fellow writer
nikolai_virta	nikolai yevgenyevich virta was a soviet writer who developed the theory of conflictless
nikolai_yut	nikolaj jakovlevic jut  was a chuvash writer folklorist and literary critic he
nikolai_zlatovratsky	nikolai nikolaievich zlatovratsky was a russian writer
nikolaos_kontopoulos	nikolaos kontopoulos was a greek writer he was born in the village of lousika
nikolay_breshko-breshkovsky	nikolay breshko-breshkovsky was a russian writer a son of the renowned revolutionary
nikolay_haytov	nikolay haytov was a bulgarian fiction writer playwright patriot and publicist
nikolay_karamzin	nikolay mikhailovich karamzin was a russian writer poet historian and critic he
nikolay_nosov	nikolaiy) nikolaevich nosov was a soviet childrens literature writer the author
nikos_e.politis	nikos politis was a greek writer journalist and historian of patras and sports he
nikos_kazantzakis	nikos kazantzakis was a greek writer celebrated for his novels which include
nikos_perakis	nikos perakis is a greek writer and film director he has studied at the fine
nikos_psyroukis	nikos psyroukis was a greek writer journalist and one of the leading modern
niksa_gradi	nikola niksa gradic was a serbian writer politician and lawyer from dubrovnik
nileena_abraham	nileena abraham is a writer and translator from kerala india she was born in
nilmoni_phukan_:senior	for other people with similar names see nilmani phookan nilmoni phukan was an
niloufar_talebi	niloufar talebi is a writer award-winning translator and theater artist she
nils_nordberg	nils nordberg is a norwegian crime writer anthology editor and audio play director he
nils-aslak_valkeapaa	nils-aslak valkeapaa known as aillohas in the northern sami language was a finnish
nina_allan	nina allan is a british writer of speculative fiction she has published four
nina_arkina	nina arkina was a russian-born norwegian writer she was born in odessa but
nina_berberova	nina nikolayevna berberova was a russian empire-born writer who chronicled the
nina_burleigh	nina d burleigh is an american writer and journalist she is the author of
nina_george	nina george is a german writer best known as the author of the little paris
nina_grunfeld	nina grunfeld is a british writer journalist public speaker and entrepreneur
nina_guthner	nina guthner was a german writer she was born at schloss bimbach or bimbach
nina_josu	nina josu is a writer and activist from moldova she is the head of the association
nince_henry	nince sekyanzi henry is a ugandan song writer and a musician he rose to prominence
ningeokuluk_teevee	ningeokuluk teevee is a canadian inuk writer and artist her first childrens
ningombam_bupenda_meitei	ningombam bupenda meitei is an indian writer essayist and poet in english and
nino_nakashidze	nino nakashidze was a georgian writer she was primarily known for her writings
nio_joe_lan	nio joe lan was a chinese-indonesian writer journalist and history teacher
nirad_c.chaudhuri	nirad chandra chaudhuri was an indian bengalienglish writer and man of letters he
nirmal_verma	nirmal verma was a hindi writer novelist activist and translator he is credited
nisi_shawl	nisi shawl is an african-american writer editor and journalist she is best
nnedi_okorafor	nnedi okorafor is a nigerian-american writer of fantasy science fiction and
nobuo_kojima	nobuo kojima was a japanese writer prominent in the postwar era he is most
nodar_dumbadze	nodar dumbadze was a georgian writer and one of the most popular authors in
noel_godin	noel godin is a belgian writer critic actor and notorious pie thrower or entarteur godin
noel_loomis	noel loomis was a writer principally of western mystery and science-fiction
noelle_chatelet	noelle chatelet is a french writer and lecturer at the paris descartes university
noelle_stevenson	stevenson attended the maryland institute college of art during her junior
noelle_valdivia	noelle valdivia is an american television writer and playwright she is best
noo_saro-wiwa	noo saro-wiwa is a britishnigerian writer and journalist
nor_sanavongsay	nor sanavongsay is an american award-winning writer and illustrator in the san
nora_bossong	nora bossong is a german writer
norah_mcclintock	norah mcclintock is a canadian writer of young-adult fiction born and raised
norbert_blei	norbert blei was an american writer of non-fiction fiction and poetry in 1994
norberto_romualdez	norberto romualdez y lopez was a philippine writer politician jurist and statesman he
nordahl_rolfsen	johan nordahl brun rolfsen was a norwegian writer educationalist and teacher
norihiro_yagi	norihiro yagi is a japanese manga writer and artist from okinawa prefecture he
noriko_ogiwara	noriko ogiwara is a japanese fantasy writer
norm_augustinus	norman theodore augustinus jr is a jewish american writercomedian
norm_phelps	norm phelps was an american writer he was a founding member of the society
norma_farber	norma holzmann farber was an american childrens book writer and poet the poetry
norma_k.hemming	norma kathleen hemming was a british-australian writer of science fiction and
norman_borisoff	norman borisoff was an american television writer award winning scriptwriter
norman_corwin	norman lewis corwin was an american writer screenwriter producer essayist and
norman_douglas	george norman douglas was a british writer now best known for his 1917 novel
norman_franks	norman leslie robert franks is an english writer who specialises in aviation
norman_grubb	norman percy grubb mc was a british christian missionary writer and theological
norman_hapgood	norman hapgood was an american writer journalist editor and critic and an american
norman_ian_mackenzie	norman ian mackenzie was a british writer journalist and educationalist who
norman_lear	norman milton lear is an american television writer and producer who produced
norman_levine	norman isaiah pryce levine was a canadian short-story writer novelist and poet he
norman_lowell	norman lowell is a maltese ultranationalist writer and head of the imperium
norman_rush	norman rush is an american writer whose introspective novels and short stories
norman_ward	norman mcqueen ward was a canadian writer and academic a longtime professor
norman_wong	norman wong is an american writer and activist he is best known for his 1995
normando_hernandez_gonzalez	normando hernandez gonzalez is a cuban writer and journalist who now lives in
norrey_ford	noreen ford dilcock was a british writer of romance novels from 1952 to 1977
norris_mcwhirter	norris dewar mcwhirter cbe was a british writer political activist co-founder
norvell_w.page	norvell wordsworth page was an american pulp fiction writer journalist and editor
nouritza_matossian	nouritza matossian is a british cypriot writer actress broadcaster and human
nowsher_ali_khan_yusufzai	nowsher ali khan yusufzai was a bengali writer and philanthropist
noy_holland	noy holland is an american writer she is married to the writer sam michel
ntone_edjabe	ntone edjabe is a cameroonian writer journalist dj and founding editor of chimurenga
nuala_ni_chonchuir	nuala ni chonchuir is an irish writer and poet
nuala_woulfe	nuala woulfe is an irish writer whose first novel chasing rainbows was published
nuggehalli_pankaja	nuggehalli pankaja is an indian writer and poet in the kannada and english languages she
nugroho_notosusanto	brigadier general raden panji nugroho notosusanto was an indonesian short story
numa_sadoul	numa sadoul born 7 may 1947 brazzaville french equatorial africa is a french
nuno_bernardo	nuno bernardo is a portuguese writer producer and director nuno has become
nur-eldeen_masalha	nur-eldeen masalha is a palestinian writer and academic he is palestinian historian
nuray_lale	nuray lale is a turkish-german writer and translator she arrived to germany
nyana_kakoma	nyana kakoma is a ugandan writer editor and blogger from kampala she created
nyo_mya	nyo mya was a famous burmese writer he came into prominence by his nationalist
o_yeong-su	o yeong-su was a south korean writer
o.e.middleton	oe middleton was a new zealand writer of short stories described as belonging
o.henry	william sydney porter known by his pen name o henry was an american short story
obert_skye	obert skye is a bestselling american childrens writer known for the leven thumps
ochirbatyn_dashbalbar	ochirbatyn dashbalbar was a mongolian writer and politician
octavia_e.butler	octavia estelle butler was an american science fiction writer a multiple recipient
octavio_cordero_palacios_:writer	octavio cordero palacios was an ecuadorian writer playwright poet mathematician
octavio_paz	octavio paz lozano was a mexican poet and diplomat he is considered by many
odd_eidem	odd eidem was a norwegian writer journalist and literary critic he was born
odveig_klyve	odveig klyve is a norwegian writer and film director among her notable publications
oh_jung-hee	oh jung-hee is a south korean writer
oh_kyu-won	oh kyu won was a south korean writer
oh_sangwon	oh sangwon was a south korean writer and journalist
oh_soo-yeon_:novelist	oh soo-yeon is a modern south korean writer
oh_takbeon	oh takbeon is a south korean writer poet and critic
ojars_vacietis	ojars vacietis was a latvian writer and poet he is often considered one of
oktay_rfat_horozcu	oktay rifat horozcu better known as oktay rifat was a turkish writer and playwright
ol_parker	oliver ol parker is an english film writer and director
olaug_lken	olaug marie lken was a norwegian writer and activist
olaus_magnus	olaus magnus was a swedish writer and catholic ecclesiastic
olav_nordra	olav nordra was a norwegian writer he won the riksmal society literature prize
olen_steinhauer	olen steinhauer is an american writer of spy fiction novels including the tourist
oles_honchar	oleksandr terentiyovych honchar was a ukrainian and soviet writer and public
olga_shapir	olga andreyevna shapir was a russian writer and feminist
olha_kobylianska	olha yulianivna kobylianska was a ukrainian modernist writer and feminist
oliva_sabuco	oliva sabuco de nantes barrera was a spanish writer in holistic medical philosophy
olivar_asselin	olivar asselin was a writer and journalist in quebec canada he was a prominent
oliver_la_farge	oliver hazard perry la farge was an american writer and anthropologist in 1925
oliver_onions	george oliver onions was a british writer of story collections and over 40 novels he
oliver_robins	oliver robins is an american writer director and former child actor his first
oliveria_prescott	oliveria louisa prescott was an english writer and composer
olivia_coolidge	margaret olivia ensor coolidge was a british-born american writer and educator she
olivier_adam	olivier adam is a french author and screenwriter his debut novel je vais bien
olivier_cadiot	olivier cadiot is a french writer poet dramatist and translator cadiot was
olivier_rolin	olivier rolin is a french writerhe won the prix femina in 1994 for his novel
olivier_weber	olivier weber is an award-winning french writer novelist and reporter at large
olle_adolphson	olle adolphson was a swedish writer singer and songwriter he released a range
olle_lansberg	olle lansberg was a swedish writer he wrote for ten films between 1947 and
olly_mann	olly mann is a writer presenter and gadget correspondent he is best known as
olof_lagercrantz	olof gustaf hugo lagercrantz was a swedish writer critic literary scholar and
olufemi_terry	olufemi terry is a sierra leone-born writer he won the 2010 caine prize for
olwen_wymark	olwen wymark was an american writer and playwright
om_prakash_valmiki	om prakash valmiki was an indian dalit writer and poet well known for his autobiography
om_raut	om raut is an indian writer director & producer he is best known for his debut
omair_ahmad	omair ahmad is an indian writer whose book jimmy the terrorist was shortlisted
omar_abd_al-kafi	omar abd al-kafi is an egyptian writer professor islamic theologian and manager
omar_ben_salem	amor ben salem is a tunisian arabic writer
omar_ibn_said	omar ibn said was a writer and islamic scholar born and educated in what is
omar_kureishi	omar kureishi was a distinguished pakistani writer he had also worked in the
omar_mouallem	omar mouallem is an award-winning writer and journalist
omar_pound	omar shakespear pound was an anglo-american writer teacher and translator
onat_kutlar	mehmet arif onat kutlar also known as onat kutlar was a prominent turkish writer
ook_chung	ook chung born in japan in 1963 is a quebecois writer chung was born to korean
opal_tometi	opal tometi is a new york-based nigerian-american writer strategist and community
opal_whiteley	opal irene whiteley was an american nature writer and diarist whose childhood
oralkhan_bokeev	oralkhan bokeev was a kazakh writer playwright and journalist
orde_m.coombs	orde musgrave coombs was an african-american writer and editor
oren_ginzburg	oren ginzburg is a french-israeli writer and cartoonist and the founder of hungry
orlando_wells	orlando wells is an english writer and actor wells has written five original
