catherine_seipp	catherine seipp was a los angeles freelance writer and media critic she is
catherine_spencer	catherine spencer is a popular canadian writer of over 40 romance novels in
catherine_storr	catherine storr was an english childrens writer best known for her novel marianne
catherine_turney	catherine turney was an american writer and screenwriter born in chicago illinois
catherine_yronwode	catherine anna cat yronwode is an american writer editor graphic designer typesetter
catherynne_m.valente	catherynne m valente is an american fiction writer poet and literary critic for
cathi_bond	cathi bond is a canadian writer broadcaster and novelist bonds upcoming novel
cathi_unsworth	cathi unsworth is an english writer and journalist after working for melody
cathleen_with	cathleen with is a canadian writer and author skids her debut short story collection
cathryn_humphris	cathryn humphris is an american television writer she has worked on the amc
cathy_park_hong	cathy park hong is a korean-american writer she teaches creative writing at
cathy_williams	cathy williams is a british writer of romance novels in mills & boon williams
catie_lazarus	catie lazarus is a writer storyteller and talk show host lazarus was awarded
catriona_sparks	catriona sparks is an australian science fiction writer editor and publisher as
cea_sunrise_person	cea sunrise person is a writer and former model best known as the author of
cecelie_berry	cecelie s berry is an american writer
cecil_e.rhode	cecil e rhode was an american writer and journalist known for his writings
cecilia_hae-jin_lee	cecilia hae-jin lee is a korean american writer artist photographer and chef she
cecilia_meireles	cecilia benevides de carvalho meireles was a brazilian writer and educator known
cecilia_tan	cecilia tan is a writer editor sexuality activist and founder of circlet press
cecilio_acosta	cecilio acosta was a venezuelan writer journalist lawyer philosopher and humanist
cedar_sigo	cedar sigo is a writer of art literature and film
ceija_stojka	ceija stojka was an austrian-romani writer painter and musicianand survivor
celeste_ng	celeste ng is an american writer and novelist she has released many short stories
celestine_hitiura_vaite	celestine hitiura vaite is a tahitian writer
celia_thaxter	celia laighton thaxter was an american writer of poetry and stories she was
celine_renooz	celine renooz was a belgian feminist writer and activist known for her works
cendrine_wolf	cendrine wolf is a french childrens writer known for co-writing the oksa pollock
cesar_aira	cesar aira is an argentine writer and translator and an exponent of argentine
cesar_falcon	cesar falcon garfias was a peruvian writer journalist and politician
cesare_balbo	cesare balbo conte di vinadio was an italian writer and statesman balbo was
cesare_sterbini	cesare sterbini was an italian writer and librettist possessing a deep knowledge
cevin_soling	cevin daniel soling is an american writer filmmaker philosopher musician music
cezaro_rossetti	cezaro rossetti was a scottish esperanto writer of italian-swiss derivation
chad_harbach	chad harbach is an american writer an editor at the journal n + 1 he is the
chad_holt	chad holt is an american writer actor and performer in austin texas he is the
chairman_butt	chairman butt the pen name of christopher woo is a hong kong writer currently
chaitanya_tamhane	chaitanya tamhane is the writer and director of the marathi movie court a 2015
chaman_nahal	chaman nahal commonly known as c nahal also known as chaman nahal azadi is an
champat_rai_jain	champat rai jain was an influential jain writer and comparative religion scholar
chan_koonchung	chan koonchung is a chinese science-fiction writer who has previously lived
chandler_owen	chandler owen was an african-american writer editor and early member of the
chandler_tuttle	chandler tuttle is an american writer and director who currently serves as creative
chandra_free	chandra free is an american writer and artist of the comic book the god machine
chandra_kumar_agarwala	chandra kumar agarwala was an eminent writer poet journalist from assam he
chandra_pemmaraju	chandra pemmaraju is a film writer and director of indian origin based out of
chandra_prasad_saikia	chandra prasad saikia was a writer from assam india he was the president of
chandradhar_barua	chandradhar barua was an eminent writer poet dramatist & lyricist from assam
chandrakant_keni	chandrakant keni was a konkani language writer and journalist from goa he was
chandramathi	chandrika balan is an indian bilingual writer who has published books in both
chanida_phaengdara_potter	chanida phaengdara potter is a lao american writer nonprofiteer and community
channing_gibson	channing gibson is an american television writer and producer he worked in
chantal_renaud	chantal renaud is a quebecoise script writer and a past ye-ye singer and actress she
chantal_thomas	chantal thomas is a french writer and historian her 2002 book farewell my queen
chara_m.curtis	chara m curtis is a writer and childrens book author from minnesota
charity_waciuma	charity waciuma is a kenyan writer who wrote several novels for adolescents
charles_a.williams_iii	charles a williams iii or dr chuck is an american writer lecturer based in
charles_alden_seltzer	charles alden seltzer was an american writer he was a prolific author of western
charles_allen_:writer	charles allen is a british freelance writer and popular historian who lives
charles_angell_bradford	charles angell bradford fsa frsl was a british writer and historian
charles_barton_:legal_writer	charles barton was an english legal writer he was called to the bar at the
charles_belfoure	charles belfoure is an american writer architect and historian
charles_blackstone	charles blackstone is an american writer and managing editor of literary website
charles_bock	charles bock is an american writer whose debut 2008 novel beautiful children
charles_bucke	charles bucke was an english writer who despite being poor most of his life
charles_burleigh_galbreath	charles burleigh galbreath was a writer historian educator and librarian in
charles_corm	charles corm was a lebanese writer billionaire industrialist and philanthropist he
charles_d'ambrosio	charles anthony dambrosio jr is an american short story writer and essayist
charles_de_lint	charles de lint is a canadian writer of dutch origins in 1974 he met maryann
charles_dickens	charles john huffam dickens was an english writer and social critic he created
charles_dryden	charles dryden was an american baseball writer and humorist he was reported
charles_dunster	charles dunster was a british writer and translator
charles_etienne_brasseur_de_bourbourg	abbe charles-etienne brasseur de bourbourg was a noted french writer ethnographer
charles_exbrayat	charles exbrayat was a french fiction writer he published over 100 novels and
charles_fort	charles hoy fort was an american writer and researcher who specialized in anomalous
charles_fox_:jazz_critic	charles richard jeremy fox was an english writer and broadcaster specialising
charles_frederick_williams	charles frederick williams was a scottish-irish writer journalist and war correspondent
charles_g.booth	charles g booth was a british-born writer who settled in america and wrote
charles_gaines	charles l gaines is an american writer and outdoorsman notable for numerous
charles_garvice	charles garvice was a prolific british writer of over 150 romance novels who
charles_gordon_:journalist	charles gordon is a canadian writer and retired journalist best known as a longtime
charles_gramlich	charles allen gramlich is an american writer best known for combining science
charles_hamilton_:writer	charles harold st john hamilton was an english writer specializing in writing
charles_harrington_elster	charles harrington elster is an american writer broadcaster and logophile in
charles_howe_:writer	charles howe was an english devotional writer and courtier during the reigns
charles_hugh_smith	charles hugh smith  is an american writer and economic commentator he is the
charles_j.guiteau	charles julius guiteau was an american writer and lawyer who was convicted of
charles_kenneth_scott_moncrieff	charles kenneth scott moncrieff mc was a scottish writer most famous for his
charles_lalo	charles lalo was a french writer on aesthetics lalo studied philosophy and
charles_lamb	charles lamb was an english writer and essayist best known for his essays of
charles_lockwood_:author	charles lockwood was an american writer and consultant on green business strategies born
charles_logan_:author	charles logan is a british science fiction writer and professional nurse he
charles_montgomery_:writer	charles montgomery is an award-winning canadian writer and urbanist primarily
charles_moseley_:writer	charles moseley who also publishes as c w r d moseley is an english writer
charles_mudede	charles tonderai mudede is a zimbabwean writer filmmaker and leftwing cultural
charles_nelson_:writer	charles nelson is an american writer best known for his 1981 novel the boy who
charles_newman_:author	charles hamilton newman was an american writer editor and dog breeder best known
charles_nisard	charles nisard was a french writer and critic and member of the institut he
charles_o'conor_:historian	charles oconor oconor don also known as charles oconor of belanagare was an
charles_officer	charles officer is a jamaican-canadian writer actor director and former professional
charles_perez	charles perez is an american writer and a former television news reporter anchor
charles_phillip_brown	charles philip brown was a telugu writer and an englishman by descent he worked
charles_quentin_fernie_pope	charles quentin fernie pope known as quentin was a new zealand writer journalist
charles_sheehan-miles	charles sheehan-miles is an american writer and veterans advocate sheehan-miles
charles_steggall	charles h steggall was an english hymn writer and composer
charles_stross	charles david george charlie stross is an award-winning british writer of science
charles_victor_de_bonstetten	charles victor de bonstetten was a swiss liberal writer
charles_watts_:secularist	charles watts was an english writer lecturer and publisher who was prominent
charles_whiting	charles henry whiting was a british writer and military historian and with some
charles_willeford	charles ray willeford iii was an american writer an author of fiction poetry
charles_wisner_barrell	charles wisner barrell was an american writer he first became significant as
charles-albert_demoustier	charles-albert demoustier was a french writer he falsely claimed to be a descendant
charles-ferdinand_ramuz	charles-ferdinand ramuz was a french-speaking swiss writer he was born in lausanne
charles-jean-francois_henault	charles-jean-francois henault was a french writer and historian
charles-louis_havas	charles-louis havas was a french writer translator and founder of the news agency
charles-olivier_michaud	charles-olivier michaud is a canadian writer director and producer from saint-romuald
charlie_angus	charles joseph charlie angus mp is a canadian writer broadcaster musician and
charlie_coffey_:writer	charlie coffey is an american writer actor and producer coffey is best known
charlie_jane_anders	charlie jane anders is an american writer and commentator she has written several
charlie_kadau	charlie kadau is an american comedy writer and editor along with his writing
charlie_rubin	charlie rubin is an american television comedy writer producer and humorist he
charlie_williams_:british_writer	charlie williams is an english writer who has published six novels and a number
charlotta_frolich	charlotta frolich was a swedish writer historian agronomist and poet she sometimes
charlotte_brown_:producer	charlotte brown is a television writer who in 1977 became the first woman showrunner
charlotte_dean	charlotte dean is a writer illustrator and visual artist known for writing and
charlotte_delbo	charlotte delbo was a french writer chiefly known for her haunting memoirs of
charlotte_elizabeth_tonna	charlotte elizabeth tonna was a popular victorian english writer and novelist
charlotte_fullerton	charlotte louise fullerton is an american writer of television novels comic
charlotte_gordon	charlotte gordon is an american writer and distinguished professor of humanities
charlotte_higgins	charlotte higgins is a british writer and journalist higgins was born in stoke-on-trent
charlotte_lady_blennerhassett	charlotte blennerhassett lady blennerhassett was a german writer and biographer
charlotte_link	charlotte link is a german writer she is among the most successful contemporary
charlotte_maria_tucker	charlotte maria tucker was a prolific writer and poet for children and adults
charlotte_o'conor_eccles	charlotte oconor eccles was an irish writer translator and journalist
charlotte_vale_allen	charlotte vale-allen is a writer of contemporary fiction she lived in the united
charlotte_von_kalb	charlotte sophia juliana von kalb was a german writer who associated with poets
charlotte_zolotow	charlotte zolotow was an american writer poet editor and publisher of many books
charly_chiarelli	calogero chiarelli is a canadian writer storyteller actor and musician born
charmaine_cadeau	charmaine cadeau is a canadian writer who won the relit award for poetry in
charmian_london	charmian kittredge london was an american writer and second wife of jack london
cheikh_tidiane_gaye	cheikh tidiane gaye is a senegalese-italian writer his first novel was published
chelsea_quinn_yarbro	chelsea quinn yarbro is an american writer she is known for her series of historical
chen_danyan	chen danyan is a woman writer based in shanghai china born in beijing she moved
chen_maiping	chen maiping is a chinese-swedish writer and poet known by the pen name wan
chen_ran	chen ran is a chinese avant-garde writer most of her works appeared in the
cheon_sang-byeong	cheon sang-byeong was a south korean writer who overcame torture impotence and
cheon_un-yeong	cheon un-yeong is a modern south korean writer
cherith_baldry	cherith baldry is a british writer of childrens fiction and fantasy fiction beside
cherrie_moraga	cherrie lawrence moraga is a chicana writer feminist activist poet essayist
cherry_potter	cherry potter is a film writer cultural commentator and psychotherapist she
cheryl_kaye_tardif	cheryl kaye tardif is a canadian mystery writer best known for canada-based
cheryl_lanham	cheryl arguile nee lanham is an american writer under her maiden name cheryl
cheryl_rubenberg	cheryl a rubenberg is a writer and researcher specializing in the middle east
chester_aaron	chester aaron is an american writer
chester_himes	chester bomar himes was an american writer his works include if he hollers
chet_faliszek	chet faliszek is an american videogame writer and one of the main writers for
chet_raymo	chet raymo is a noted writer educator and naturalist he is professor emeritus
chetan_joshi_:writer	chetan joshi is an indian short story writer and a novelist his debut book
chetty_bhanumurthy	chetti bhanumurthy was a hymn writer whose hymns are found in the hymnal in
chi_li	chi li born in xiantao hubei province of china is a contemporary female chinese
chiaki_j.konaka	chiaki j konaka is a japanese writer and scenarist best known for serial experiments
chiaki_kawamata	chiaki kawamata is a japanese science fiction writer and critic chiaki kawamata
chiara_matraini	chiara matraini was an italian renaissance writer from lucca primarily known
chigozie_obioma	chigozie obioma is a nigerian writer currently he is an assistant professor
chin_ce	chin ce is a nigerian writer of poetry fiction and essays
chinelo_okparanta	chinelo okparanta is a nigerian-american writer born and raised in port harcourt
ching_he_huang	this is a chinese name the family name is huang ching-he huang is a british
chingiz_abdullayev	chingiz akif oglu abdullayev is azerbaijani writer secretary of the union of
chintapalli_ramana	chintapalli venkata ramana babu is a telugu film writer his screen name is
chintha_lakshmi_sinhaarachchi	chintha lakshmi sinhaarachchi is a sri lankan writer who is best known for her
chintha_ravi	k ravindran better known by his pen-name chintha ravi was an indian writer
chinthana_dharmadasa	chinthana dharmadasa is a sri lankan writer film director film critic and a
chip_johannessen	george f chip johannessen is an american writer editor and producer of several
chirlane_mccray	chirlane irene mccray is an american writer editor communications professional
chito_s.rono	chito s rono also known as sixto kayko is a filipino writer film producer and
chitra_fernando	chitra fernando was a female writer and critic from sri lanka born in kalutara
chittaranjan_nepali	chittaranjan nepali is a writer and winner of madan puraskar of nepal
chitti_:writer	p g sundarrajan was an indian writer who was associated with the manikodi at
chloe_leland	chloe leland is an award-winning writer director executive producer and vfx
cho_hae-il	cho hae-il is a south korean writer
cho_seon-jak	cho seon-jak is a south korean writer
choe_yun	choe hyon-mu better known by her pen name choe yun is a south korean writer
chohei_kambayashi	chohei kambayashi is a japanese science fiction writer born in niigata kambayashi
choi_il-nam	choi il-nam is a south korean writer
choi_in-ho	choi in-ho was a south korean writer
choi_in-hun	choi in-hun is a south korean writer
chong_hyon-jong	chong hyon-jong is a south korean writer and reporter
chowdhury_gulam_akbar	chowdhury gulam akbar was a bangladeshi writer he served in the bangla academy
chris_allen_:author	chris allen is an australian thriller writer based in sydney australia a former
chris_bachelder	chris bachelder is an american writer e-book pioneer and frequent contributor
chris_bartlett_:writer	chris bartlett is a london-based writer and journalist along with nick awde
chris_boucher	chris boucher is a british television writer known for his frequent contributions
chris_brancato	chris brancato is a hollywood writer and producer of several films and television
chris_broadribb	chris broadribb is an award-winning australian writer who has written three
chris_bunting	chris bunting is a british comic book writer
chris_campanioni	chris campanioni is an american writer of cuban and polish descent he was born
chris_chantler_:writer	chris chantler is a british comedy writer occasional performer and doom metal
chris_chibnall	chris chibnall is an english television writer he is best known for his work
chris_claremont	christopher s chris claremont is a british-born american comic book writer
chris_cleave	chris cleave is a british writer and journalist
chris_collins_:writer	chris collins is an american television writer and producer he has worked on
chris_d'lacey	chris dlacey is an english writer of childrens fiction he is best known for
chris_downey	chris downey is an american writer and producer downey got his start as a television
chris_gifford_:actor	chris gifford is a writer and executive producer at nickelodeon where he co-created
chris_hayward	christopher robert chris hayward was an american television writer and producer he
chris_joseph_:writer_artist	chris joseph is britishcanadian multimedia writer and artist who also creates
chris_kelly_:writer	chris kelly is an american writer and director known for his work on saturday
chris_kraus_:american_writer	chris kraus is an american writer and filmmaker her novels include i love dick
chris_lang	chris lang is a british television writer actor and producer
chris_langham	christopher chris langham is an english writer actor and comedian he is known
chris_lawson	chris lawson is an australian writer of speculative fiction
chris_lynch	chris lynch is an american writer of books for young people his works include
chris_mannix	chris mannix is a sports writer reporter and radio host for sports illustrated
chris_marker	chris marker was a french writer photographer documentary film director multimedia
chris_maslanka	christopher m maslanka is a british writer and broadcaster specialising in
chris_mckenna_:writer	chris mckenna is a television writer producer and film writer he has written
chris_mckinney	chris mckinney is an american writer born and raised in hawaii
chris_rafferty	chris rafferty is an american television writer
chris_regan	chris regan is an american comedy writer from 1999 to 2006 regan was a writer
chris_scott_:writer	chris scott is an english-canadian writer his novel antichthon was a nominee
chris_sheridan_:writer	christopher chris sheridan is an american television writer producer and occasional
chris_shipley	chris shipley is a writer analyst commentator and strategist and has tracked
chris_stedman	chris stedman is an american writer and interfaith activist who serves as the
chris_thompson_:tv_producer	chris thompson was an american television writer producer and director since
chris_zook	chris zook is a business writer and partner at bain & company leading its global
christabel_bielenberg	christabel bielenberg was a british writer who was married to a german lawyer
christian_beranek	christian beranek is a united states writer actress musician and filmtv producer
christian_cooper	christian cooper is a comic book writer based in new york city
christian_gudegast	christian gudegast is an american writer and filmmaker gudegast is the son
christian_murray	christian murray is a canadian comedy writer he has written for this hour has
christian_tamas	christian tamas is a romanian writer translator essayist arts and humanities
christiana_spens	christiana spens is a writer and illustrator she was educated at the university
christiane_akoua_ekue	christiane tchotcho akoua ekue is a togolese writer writing in french and a
christiane_koren	christiane koren was a danish-norwegian writer she wrote both poems and plays
christiane_rochefort	christiane rochefort was a french feminist writer she was born into a left-wing
christianna_brand	christianna brand was a british crime writer and childrens author born in british
christianne_meneses_jacobs	christianne meneses jacobs is a nicaraguan american writer editor and teacher she
christie_harris	christie lucy harris cm was a canadian childrens writer she is best known for
christina_crawford	christina crawford is an american writer and actress best known as the author
christina_hardyment	christina hardyment is a british writer who has written on a wide range of subjects
christina_lauren	christina lauren is an american author of contemporary fiction teen fiction
christina_m.kim	christina m kim is an american television writer in the 2005-06 television
christina_vella	christina vella is a writer historian of modern europe and adjunct professor
christine_adamo	christine adamo is a french writer who comes from the world of the sciences specialized
christine_angot	christine angot is a french writer novelist and playwright
christine_beatty_:activist	christine beatty is an american writer musician and transgender activist she
christine_boylan	christine ann boylan is an american television writer and producer she is known
christine_bruckner	christine bruckner was a german writer
christine_craig	christine craig is a jamaican writer living in florida she has published collections
christine_edwards	christine edwards is a british film writer and producer christine founded independent
christine_feehan	christine feehan is an american romance-paranormal writer she has published
christine_harris_:author	christine harris is an australian writer of childrens and young-adult with works
christine_miscione	christine miscione is a canadian writer who won the relit award for short fiction
christine_piper	christine piper is an australian writer based in new york her first novel after
christine_whelan	christine barrett whelan is a writer journalist and commentator she is the
christoph_von_schmid	christoph von schmid was a writer of childrens stories and an educatorhis stories
christophe_claro	christophe claro better known as claro is a french writer and translator he
christophe_honore	christophe honore is a french writer and film director honore was born in carhaix
christophe_naudin	christophe naudin born in libourne france in 1962 is a french writer
christopher_belton	christopher belton is a writer of both fiction and non-fiction and a japaneseenglish
christopher_bertolini	christopher bertolini is a film writer and producer who is known for writing
christopher_cook_:writer	christopher lavaughn cook is an american writer whose writing styles and genres
christopher_dow_:author	christopher dow is an american writer he is the author of three volumes of
christopher_fowler	christopher fowler is an english thriller writer he is the award-winning author
christopher_frey	christopher frey is a german writer he grew up in a political and international
christopher_g.moore	christopher g moore is a canadian writer of twenty-five novels five works of
christopher_g.nuttall	christopher g nuttall is a prolific writer from britain who writes fantasy
christopher_green_:author	christopher green is an australian writer of speculative short fiction
christopher_h.bidmead	christopher hamilton bidmead is a british writer and journalist bidmead trained
christopher_hurn	christopher hurn is an american writer entrepreneur and business executive who
christopher_k.travis	christopher k travis is a writer publisher theorist and the managing partner
christopher_landon	christopher guy landon known as christopher landon was a british writer of novels
christopher_levett	capt christopher levett was an english writer explorer and naval captain born
christopher_lukas	christopher lukas is a writer television producer and director who for the past
christopher_matthew	christopher charles forrest matthew is a british writer and broadcaster he
christopher_mckitterick	christopher mckitterick is an american writer of science fiction and an academic
christopher_moeller	christopher moeller is an american writer and painter specializing in fully
